{
  "shape": "rect",
  "diameter": 250,
  "angle": 0,
  "circular_bolts": 5,
  "s_c": 125,
  "s_r": 125,
  "x_bolts": 2,
  "y_bolts": 3,
  "bolts_table": [
    {
      "x": 0,
      "y": 0
    }
  ],
  "edge_type": "sheared",
  "L_eh": 50,
  "L_ev": 50,
  "L_ehl": 50,
  "L_evb": 50,
  "L_ehr": 50,
  "L_evt": 50,
  "plate_width": 500,
  "plate_height": 500,
  "t": 25,
  "bolt_size": 16,
  "grade": "A307",
  "f_ub": 825,
  "shear_plane": "included",
  "bolt_type": "bearing",
  "faying_surface": "A",
  "plate_grade": "300W",
  "f_y": 350,
  "f_u": 480,
  "U_t": 1,
  "hole": "standard",
  "clearance": 2,
  "d_h": 18,
  "d_l": 24,
  "prying_method": "vertical",
  "prying_factor": 1.1,
  "stub_thickness": 25,
  "Fx": 1,
  "Fy": 0,
  "Fz": 0,
  "Mx": 1,
  "My": 0,
  "Mz": 1,
  "graph_on": "hide",
  "uid": "6019-csa-bolt-group",
  "current_unit_system": "metric",
  "project_details": {
    "project_company": "",
    "project_name": "",
    "project_designer": "",
    "project_id": "",
    "project_client": "",
    "project_notes": ""
  }
}